{
  "contract": "cv-import",
  "contractVersion": "1.0",
  "id": "11111111-1111-4111-8111-111111111111",
  "revision": 1,
  "sha256": "aaaaaaaaaaaaaaaaaaaaaaaaaaaaaaaaaaaaaaaaaaaaaaaaaaaaaaaaaaaaaaaa",
  "status": "facts_pending",
  "createdAt": "2026-08-14T12:00:00.000Z",
  "updatedAt": "2026-08-14T12:00:00.000Z",
  "activeRecognitionVersionId": "recognition-0123456789abcdef",
  "source": {
    "fileName": "synthetic-cv.html",
    "mimeType": "text/html",
    "bytes": 42,
    "sha256": "bbbbbbbbbbbbbbbbbbbbbbbbbbbbbbbbbbbbbbbbbbbbbbbbbbbbbbbbbbbbbbbb",
    "retention": "upload_deleted_after_local_extraction"
  },
  "facts": [{
    "id": "fact-synthetic", "claimId": "claim-synthetic", "category": "skill", "recordId": "skill-synthetic",
    "field": "name", "value": "Synthetic Skill", "decision": "pending",
    "provenance": { "sourceSha256": "bbbbbbbbbbbbbbbbbbbbbbbbbbbbbbbbbbbbbbbbbbbbbbbbbbbbbbbbbbbbbbbb", "anchor": "line:1", "origin": "imported" }
  }],
  "warnings": []
}
